0100000US,,United States,310M300US27380,27380,"United States - Jacksonville, TX Micro Area","Jacksonville, TX Micro Area",50845,50834,50939,51076,51261,51088,51174,51573,51896,52240
0100000US,,United States,310M300US27420,27420,"United States - Jamestown, ND Micro Area","Jamestown, ND Micro Area",21100,21100,21133,21018,20972,21088,21100,21005,21009,21087
0100000US,,United States,310M300US27460,27460,"United States - Jamestown-Dunkirk-Fredonia, NY Micro Area","Jamestown-Dunkirk-Fredonia, NY Micro Area",134905,134904,134727,134220,133333,132896,131892,130756,129638,129046
0100000US,,United States,310M300US27540,27540,"United States - Jasper, IN Micro Area","Jasper, IN Micro Area",54734,54653,54688,54806,54750,54823,54837,54785,54884,54923
0100000US,,United States,310M300US27600,27600,"United States - Jefferson, GA Micro Area","Jefferson, GA Micro Area",60485,60460,60699,60976,60857,61285,62098,63375,64978,67519
0100000US,,United States,310M300US27660,27660,"United States - Jennings, LA Micro Area","Jennings, LA Micro Area",31594,31594,31634,31590,31448,31299,31450,31428,31370,31477
0100000US,,United States,310M300US27700,27700,"United States - Jesup, GA Micro Area","Jesup, GA Micro Area",30099,30099,30076,30300,30333,30007,29913,29441,29985,29817
0100000US,,United States,310M300US27920,27920,"United States - Junction City, KS Micro Area","Junction City, KS Micro Area",34362,34357,35247,35275,37886,36777,36459,36682,35208,33855
0100000US,,United States,310M300US27940,27940,"United States - Juneau, AK Micro Area","Juneau, AK Micro Area",31275,31275,31394,32162,32395,32570,32490,32612,32405,32094
0100000US,,United States,310M300US28060,28060,"United States - Kalispell, MT Micro Area","Kalispell, MT Micro Area",90928,90928,90853,91236,91576,92835,94468,95738,97693,100000
0100000US,,United States,310M300US28180,28180,"United States - Kapaa, HI Micro Area","Kapaa, HI Micro Area",67091,67091,67199,67832,68573,69626,70523,71387,71769,72159
0100000US,,United States,310M300US28260,28260,"United States - Kearney, NE Micro Area","Kearney, NE Micro Area",52591,52591,52657,53389,54176,54536,54851,55302,55951,56262
0100000US,,United States,310M300US28300,28300,"United States - Keene, NH Micro Area","Keene, NH Micro Area",77117,77117,77050,76874,76802,76590,76263,76036,75697,75960
0100000US,,United States,310M300US28340,28340,"United States - Kendallville, IN Micro Area","Kendallville, IN Micro Area",47536,47540,47453,47309,47213,47267,47400,47543,47442,47452
0100000US,,United States,310M300US28380,28380,"United States - Kennett, MO Micro Area","Kennett, MO Micro Area",31953,31953,31946,32006,31841,31723,31304,30825,30556,30119
0100000US,,United States,310M300US28500,28500,"United States - Kerrville, TX Micro Area","Kerrville, TX Micro Area",49625,49625,49619,49607,49686,49760,50275,50753,51296,51720
0100000US,,United States,310M300US28540,28540,"United States - Ketchikan, AK Micro Area","Ketchikan, AK Micro Area",13477,13491,13544,13644,13700,13682,13780,13680,13727,13856
0100000US,,United States,310M300US28580,28580,"United States - Key West, FL Micro Area","Key West, FL Micro Area",73090,73090,73219,73981,74627,75914,76492,77003,77304,77013
0100000US,,United States,310M300US28620,28620,"United States - Kill Devil Hills, NC Micro Area","Kill Devil Hills, NC Micro Area",38327,38327,38399,38514,38546,38954,39027,39579,39799,40151
0100000US,,United States,310M300US28780,28780,"United States - Kingsville, TX Micro Area","Kingsville, TX Micro Area",32477,32474,32450,32462,32536,32451,32281,31831,31775,31505
0100000US,,United States,310M300US28820,28820,"United States - Kinston, NC Micro Area","Kinston, NC Micro Area",59495,59518,59499,59441,59164,58831,58397,58126,57432,56883
0100000US,,United States,310M300US28860,28860,"United States - Kirksville, MO Micro Area","Kirksville, MO Micro Area",30038,30038,30066,30023,30054,30079,29926,29831,29714,29885
0100000US,,United States,310M300US28900,28900,"United States - Klamath Falls, OR Micro Area","Klamath Falls, OR Micro Area",66380,66380,66313,66287,65923,65730,65364,65777,66283,66935
0100000US,,United States,310M300US29060,29060,"United States - Laconia, NH Micro Area","Laconia, NH Micro Area",60088,60072,60094,60265,60327,60106,60172,60248,60606,60785
0100000US,,United States,310M300US29260,29260,"United States - La Grande, OR Micro Area","La Grande, OR Micro Area",25748,25744,25729,25879,25772,25500,25610,25676,26043,26222
0100000US,,United States,310M300US29300,29300,"United States - LaGrange, GA Micro Area","LaGrange, GA Micro Area",67044,67040,67053,67637,68304,68809,69267,69527,69776,69786
0100000US,,United States,310M300US29380,29380,"United States - Lake City, FL Micro Area","Lake City, FL Micro Area",67531,67530,67556,67309,67886,67429,67851,68255,69274,69612
0100000US,,United States,310M300US29500,29500,"United States - Lamesa, TX Micro Area","Lamesa, TX Micro Area",13833,13833,13827,13744,13601,13202,13434,12984,13042,12813
0100000US,,United States,310M300US29660,29660,"United States - Laramie, WY Micro Area","Laramie, WY Micro Area",36299,36299,36433,36883,37332,37573,37793,38036,37987,38332
0100000US,,United States,310M300US29780,29780,"United States - Las Vegas, NM Micro Area","Las Vegas, NM Micro Area",29393,29387,29404,29332,29058,28749,28418,28144,27956,27748
0100000US,,United States,310M300US29860,29860,"United States - Laurel, MS Micro Area","Laurel, MS Micro Area",84823,84823,84804,84753,84879,85349,84832,84914,84772,84512
0100000US,,United States,310M300US29900,29900,"United States - Laurinburg, NC Micro Area","Laurinburg, NC Micro Area",36157,36157,36059,36276,36091,35907,35658,35319,35250,35093
0100000US,,United States,310M300US29980,29980,"United States - Lawrenceburg, TN Micro Area","Lawrenceburg, TN Micro Area",41869,41851,41967,42064,42073,41921,42210,42449,42979,43396
0100000US,,United States,310M300US30060,30060,"United States - Lebanon, MO Micro Area","Lebanon, MO Micro Area",35571,35571,35675,35635,35451,35625,35505,35442,35427,35443
0100000US,,United States,310M300US30220,30220,"United States - Levelland, TX Micro Area","Levelland, TX Micro Area",22935,22927,22851,22927,23063,23400,23461,23315,23103,23088
0100000US,,United States,310M300US30260,30260,"United States - Lewisburg, PA Micro Area","Lewisburg, PA Micro Area",44947,44949,44990,45084,45155,44743,44964,45536,45440,44595
0100000US,,United States,310M300US30280,30280,"United States - Lewisburg, TN Micro Area","Lewisburg, TN Micro Area",30617,30606,30681,30840,30915,31070,31250,31543,31973,32931
0100000US,,United States,310M300US30380,30380,"United States - Lewistown, PA Micro Area","Lewistown, PA Micro Area",46682,46682,46634,46712,46738,46635,46492,46427,46316,46388
0100000US,,United States,310M300US30420,30420,"United States - Lexington, NE Micro Area","Lexington, NE Micro Area",26370,26370,26358,26234,26102,26090,26052,25996,25846,25737
0100000US,,United States,310M300US30580,30580,"United States - Liberal, KS Micro Area","Liberal, KS Micro Area",22952,22950,22979,23163,23400,23354,23297,23174,22756,22159
0100000US,,United States,310M300US30660,30660,"United States - Lincoln, IL Micro Area","Lincoln, IL Micro Area",30305,30305,30281,30252,30333,29793,29644,29412,29338,29245
0100000US,,United States,310M300US30820,30820,"United States - Lock Haven, PA Micro Area","Lock Haven, PA Micro Area",39238,39241,39244,39471,39696,39798,39456,39367,38985,38998
0100000US,,United States,310M300US30880,30880,"United States - Logan, WV Micro Area","Logan, WV Micro Area",36743,36745,36713,36446,36303,35919,35235,34419,33644,32925
0100000US,,United States,310M300US30900,30900,"United States - Logansport, IN Micro Area","Logansport, IN Micro Area",38966,38966,38978,38924,38769,38574,38493,38168,38013,37994
0100000US,,United States,310M300US30940,30940,"United States - London, KY Micro Area","London, KY Micro Area",126369,126369,126561,127065,126764,127154,127204,127366,127417,127615
0100000US,,United States,310M300US31060,31060,"United States - Los Alamos, NM Micro Area","Los Alamos, NM Micro Area",17950,17950,17995,18177,18169,17830,17710,17725,18152,18738
0100000US,,United States,310M300US31220,31220,"United States - Ludington, MI Micro Area","Ludington, MI Micro Area",28705,28687,28715,28633,28643,28647,28711,28721,28846,29073
0100000US,,United States,310M300US31260,31260,"United States - Lufkin, TX Micro Area","Lufkin, TX Micro Area",86771,86771,86903,87282,87496,87365,87601,87901,87830,87805
0100000US,,United States,310M300US31300,31300,"United States - Lumberton, NC Micro Area","Lumberton, NC Micro Area",134168,134233,134504,135221,135684,135217,135035,134562,133514,132606
0100000US,,United States,310M300US31380,31380,"United States - Macomb, IL Micro Area","Macomb, IL Micro Area",32612,32612,32630,32503,32538,32215,31892,31670,31387,30823
0100000US,,United States,310M300US31500,31500,"United States - Madison, IN Micro Area","Madison, IN Micro Area",32428,32404,32402,32283,32450,32404,32410,32313,32249,32089
0100000US,,United States,310M300US31580,31580,"United States - Madisonville, KY Micro Area","Madisonville, KY Micro Area",46920,46920,46840,46844,46619,46431,46172,46067,45708,45547
0100000US,,United States,310M300US31620,31620,"United States - Magnolia, AR Micro Area","Magnolia, AR Micro Area",24552,24552,24722,24682,24373,24247,24014,24089,23983,23627
0100000US,,United States,310M300US31660,31660,"United States - Malone, NY Micro Area","Malone, NY Micro Area",51599,51606,51653,51554,51811,51246,51158,50609,51139,51116
0100000US,,United States,310M300US31680,31680,"United States - Malvern, AR Micro Area","Malvern, AR Micro Area",32923,33009,33227,33129,33492,33506,33396,33478,33446,33574
0100000US,,United States,310M300US31820,31820,"United States - Manitowoc, WI Micro Area","Manitowoc, WI Micro Area",81442,81442,81328,81037,80729,80489,79946,79457,79331,79175
0100000US,,United States,310M300US31930,31930,"United States - Marietta, OH Micro Area","Marietta, OH Micro Area",61778,61778,61705,61588,61424,61334,61118,60952,60535,60418
0100000US,,United States,310M300US31940,31940,"United States - Marinette, WI-MI Micro Area","Marinette, WI-MI Micro Area",65778,65778,65630,65269,65061,64992,64549,64099,63510,63356
0100000US,,United States,310M300US31980,31980,"United States - Marion, IN Micro Area","Marion, IN Micro Area",70061,70063,69906,69639,69118,68893,68371,67519,66802,66491
0100000US,,United States,310M300US32000,32000,"United States - Marion, NC Micro Area","Marion, NC Micro Area",44996,44996,45098,45059,45019,45069,45080,45049,44989,45159
0100000US,,United States,310M300US32020,32020,"United States - Marion, OH Micro Area","Marion, OH Micro Area",66501,66501,66455,66584,66267,65952,65784,65379,65334,64967
0100000US,,United States,310M300US32100,32100,"United States - Marquette, MI Micro Area","Marquette, MI Micro Area",67077,67077,67083,67446,67810,67750,67734,67280,66461,66502
0100000US,,United States,310M300US32140,32140,"United States - Marshall, MN Micro Area","Marshall, MN Micro Area",25857,25857,25846,25820,25624,25720,25761,25771,25861,25831
0100000US,,United States,310M300US32180,32180,"United States - Marshall, MO Micro Area","Marshall, MO Micro Area",23370,23370,23417,23336,23479,23224,23277,23035,22852,22660
0100000US,,United States,310M300US32220,32220,"United States - Marshall, TX Micro Area","Marshall, TX Micro Area",65631,65629,65752,66324,66242,66254,66626,66760,66730,66661
0100000US,,United States,310M300US32260,32260,"United States - Marshalltown, IA Micro Area","Marshalltown, IA Micro Area",40648,40648,40687,40953,41007,40913,40672,40346,40160,40288
0100000US,,United States,310M300US32280,32280,"United States - Martin, TN Micro Area","Martin, TN Micro Area",35021,35015,35042,34855,34548,34144,33987,33846,33568,33337
0100000US,,United States,310M300US32300,32300,"United States - Martinsville, VA Micro Area","Martinsville, VA Micro Area",67972,67996,67893,67146,66605,66175,65574,65218,64723,64369
0100000US,,United States,310M300US32340,32340,"United States - Maryville, MO Micro Area","Maryville, MO Micro Area",23370,23370,23396,23414,23311,23141,22987,22629,22492,22472
0100000US,,United States,310M300US32380,32380,"United States - Mason City, IA Micro Area","Mason City, IA Micro Area",51749,51749,51683,51526,51193,51007,50728,50430,50539,50475
0100000US,,United States,310M300US32460,32460,"United States - Mayfield, KY Micro Area","Mayfield, KY Micro Area",37121,37121,37225,37568,37516,37339,37523,37165,37148,37121
0100000US,,United States,310M300US32500,32500,"United States - Maysville, KY Micro Area","Maysville, KY Micro Area",17490,17490,17505,17548,17467,17330,17137,17036,17158,17174
0100000US,,United States,310M300US32540,32540,"United States - McAlester, OK Micro Area","McAlester, OK Micro Area",45837,45837,45781,45691,45516,45251,44833,44701,44395,44184
0100000US,,United States,310M300US32620,32620,"United States - McComb, MS Micro Area","McComb, MS Micro Area",53535,53535,53577,53563,53017,52792,52535,52408,52038,51915
0100000US,,United States,310M300US32660,32660,"United States - McMinnville, TN Micro Area","McMinnville, TN Micro Area",39839,39824,39860,39887,39731,39859,39934,40206,40400,40651
0100000US,,United States,310M300US32700,32700,"United States - McPherson, KS Micro Area","McPherson, KS Micro Area",29180,29152,29097,29114,29181,29373,28863,28615,28402,28708
0100000US,,United States,310M300US32740,32740,"United States - Meadville, PA Micro Area","Meadville, PA Micro Area",88765,88761,88631,88188,87754,87579,87293,86701,86505,86159
0100000US,,United States,310M300US32860,32860,"United States - Menomonie, WI Micro Area","Menomonie, WI Micro Area",43857,43857,43877,43778,43786,44013,44046,44219,44327,44693
0100000US,,United States,310M300US32940,32940,"United States - Meridian, MS Micro Area","Meridian, MS Micro Area",107449,107454,107624,107630,107196,106974,105738,104308,103078,101866
0100000US,,United States,310M300US32980,32980,"United States - Merrill, WI Micro Area","Merrill, WI Micro Area",28743,28743,28777,28465,28486,28318,28096,27863,27854,27838
0100000US,,United States,310M300US33020,33020,"United States - Mexico, MO Micro Area","Mexico, MO Micro Area",25529,25529,25451,25527,25527,25544,25815,25941,25875,25641
0100000US,,United States,310M300US33060,33060,"United States - Miami, OK Micro Area","Miami, OK Micro Area",31848,31848,31854,31839,32122,32107,31876,31805,31523,31312
0100000US,,United States,310M300US33180,33180,"United States - Middlesborough, KY Micro Area","Middlesborough, KY Micro Area",28691,28691,28708,28656,28295,28041,27841,27379,27192,26894
0100000US,,United States,310M300US33300,33300,"United States - Milledgeville, GA Micro Area","Milledgeville, GA Micro Area",55149,55242,55125,54543,55580,55123,54428,54105,53847,53467
0100000US,,United States,310M300US33420,33420,"United States - Mineral Wells, TX Micro Area","Mineral Wells, TX Micro Area",28111,28122,28082,28052,27856,27872,28016,27956,28132,28570
0100000US,,United States,310M300US33500,33500,"United States - Minot, ND Micro Area","Minot, ND Micro Area",69540,69539,69996,72329,73913,76506,78176,79955,78664,77309
0100000US,,United States,310M300US33580,33580,"United States - Mitchell, SD Micro Area","Mitchell, SD Micro Area",22835,22835,22815,22948,23120,23143,23190,23106,23221,23127
0100000US,,United States,310M300US33620,33620,"United States - Moberly, MO Micro Area","Moberly, MO Micro Area",25414,25414,25454,25275,25325,24944,25048,25030,24970,24945
0100000US,,United States,310M300US33940,33940,"United States - Montrose, CO Micro Area","Montrose, CO Micro Area",41276,41278,41187,40925,40605,40509,40553,40534,41160,41784
0100000US,,United States,310M300US33980,33980,"United States - Morehead City, NC Micro Area","Morehead City, NC Micro Area",66469,66463,66700,67426,67776,68386,68644,68729,68855,68881
0100000US,,United States,310M300US34020,34020,"United States - Morgan City, LA Micro Area","Morgan City, LA Micro Area",54650,54650,54556,54135,53545,53550,53273,52920,52174,50973
0100000US,,United States,310M300US34140,34140,"United States - Moscow, ID Micro Area","Moscow, ID Micro Area",37244,37239,37252,37806,38072,38196,38503,38661,38792,39333
0100000US,,United States,310M300US34180,34180,"United States - Moses Lake, WA Micro Area","Moses Lake, WA Micro Area",89120,89120,89571,90650,91442,91821,92839,93380,93904,95158
0100000US,,United States,310M300US34220,34220,"United States - Moultrie, GA Micro Area","Moultrie, GA Micro Area",45498,45497,45649,45852,46127,46252,46029,45665,45671,45835
0100000US,,United States,310M300US34260,34260,"United States - Mountain Home, AR Micro Area","Mountain Home, AR Micro Area",41513,41513,41511,41341,41076,40976,40871,41118,41145,41355
0100000US,,United States,310M300US34300,34300,"United States - Mountain Home, ID Micro Area","Mountain Home, ID Micro Area",27038,27038,27123,26195,26270,26239,26220,25790,26090,26823
0100000US,,United States,310M300US34340,34340,"United States - Mount Airy, NC Micro Area","Mount Airy, NC Micro Area",73673,73748,73777,73537,73346,72718,72557,72029,72049,72224
0100000US,,United States,310M300US34380,34380,"United States - Mount Pleasant, MI Micro Area","Mount Pleasant, MI Micro Area",70311,70311,70286,70556,70571,70093,69933,70637,71133,71063
0100000US,,United States,310M300US34420,34420,"United States - Mount Pleasant, TX Micro Area","Mount Pleasant, TX Micro Area",32334,32334,32414,32423,32634,32623,32460,32720,32615,32904
0100000US,,United States,310M300US34460,34460,"United States - Mount Sterling, KY Micro Area","Mount Sterling, KY Micro Area",44396,44398,44530,44880,44981,45546,45788,46130,46378,46761
0100000US,,United States,310M300US34500,34500,"United States - Mount Vernon, IL Micro Area","Mount Vernon, IL Micro Area",38827,38825,38757,38742,38650,38629,38376,38300,38308,38179
0100000US,,United States,310M300US34540,34540,"United States - Mount Vernon, OH Micro Area","Mount Vernon, OH Micro Area",60921,60930,61092,61271,60740,60787,60929,60916,60832,61261
0100000US,,United States,310M300US34660,34660,"United States - Murray, KY Micro Area","Murray, KY Micro Area",37191,37191,37343,37655,38021,38323,38423,38642,38772,38919
0100000US,,United States,310M300US34700,34700,"United States - Muscatine, IA Micro Area","Muscatine, IA Micro Area",42745,42749,42741,42771,42860,42931,42936,42964,42904,42880
0100000US,,United States,310M300US34780,34780,"United States - Muskogee, OK Micro Area","Muskogee, OK Micro Area",70990,70988,71115,70736,70518,70175,69731,69317,69046,69086
0100000US,,United States,310M300US34860,34860,"United States - Nacogdoches, TX Micro Area","Nacogdoches, TX Micro Area",64524,64524,64683,65639,65821,65163,65187,65464,65662,65580
0100000US,,United States,310M300US35020,35020,"United States - Natchez, MS-LA Micro Area","Natchez, MS-LA Micro Area",53119,53119,53405,53248,52670,52607,52436,51627,51434,50869
0100000US,,United States,310M300US35060,35060,"United States - Natchitoches, LA Micro Area","Natchitoches, LA Micro Area",39566,39566,39526,39371,39337,39112,39126,39003,38995,39021
0100000US,,United States,310M300US35140,35140,"United States - Newberry, SC Micro Area","Newberry, SC Micro Area",37508,37508,37613,37516,37548,37481,37718,37841,38044,38488
0100000US,,United States,310M300US35220,35220,"United States - New Castle, IN Micro Area","New Castle, IN Micro Area",49462,49466,49529,49215,49113,48850,48892,48664,48364,48476
0100000US,,United States,310M300US35260,35260,"United States - New Castle, PA Micro Area","New Castle, PA Micro Area",91108,91140,90975,90452,89860,89337,88801,88317,87631,87069
0100000US,,United States,310M300US35420,35420,"United States - New Philadelphia-Dover, OH Micro Area","New Philadelphia-Dover, OH Micro Area",92582,92582,92548,92482,92413,92586,92613,92673,92485,92297
0100000US,,United States,310M300US35440,35440,"United States - Newport, OR Micro Area","Newport, OR Micro Area",46034,46032,45996,45842,46145,46318,46349,47051,47897,48920
0100000US,,United States,310M300US35460,35460,"United States - Newport, TN Micro Area","Newport, TN Micro Area",35662,35642,35641,35401,35455,35325,35201,35068,35160,35556
0100000US,,United States,310M300US35500,35500,"United States - Newton, IA Micro Area","Newton, IA Micro Area",36842,36842,36813,36613,36524,36718,36870,36729,36661,36966
0100000US,,United States,310M300US35580,35580,"United States - New Ulm, MN Micro Area","New Ulm, MN Micro Area",25893,25893,25842,25653,25410,25266,25264,25228,25262,25194
0100000US,,United States,310M300US35700,35700,"United States - Nogales, AZ Micro Area","Nogales, AZ Micro Area",47420,47423,47425,47615,47292,46845,46468,46191,46075,46212
0100000US,,United States,310M300US35740,35740,"United States - Norfolk, NE Micro Area","Norfolk, NE Micro Area",48271,48270,48361,48381,48380,48446,48381,48113,48078,48270
0100000US,,United States,310M300US35820,35820,"United States - North Platte, NE Micro Area","North Platte, NE Micro Area",37590,37590,37563,37366,37278,37256,36919,36780,36776,36547
0100000US,,United States,310M300US35860,35860,"United States - North Vernon, IN Micro Area","North Vernon, IN Micro Area",28525,28529,28481,28151,28139,28222,27910,27822,27622,27626
0100000US,,United States,310M300US35900,35900,"United States - North Wilkesboro, NC Micro Area","North Wilkesboro, NC Micro Area",69340,69303,69262,68942,68927,68642,68455,68320,68634,68576
0100000US,,United States,310M300US35940,35940,"United States - Norwalk, OH Micro Area","Norwalk, OH Micro Area",59626,59625,59557,59390,59160,58762,58562,58277,58391,58494
0100000US,,United States,310M300US36020,36020,"United States - Oak Harbor, WA Micro Area","Oak Harbor, WA Micro Area",78506,78506,78670,78901,78994,78166,78655,79999,81638,83159
0100000US,,United States,310M300US36300,36300,"United States - Ogdensburg-Massena, NY Micro Area","Ogdensburg-Massena, NY Micro Area",111944,111941,111825,112316,112444,112067,111601,110803,109989,109623
0100000US,,United States,310M300US36340,36340,"United States - Oil City, PA Micro Area","Oil City, PA Micro Area",54984,54983,54973,54683,54211,53840,53363,52966,52469,51762
0100000US,,United States,310M300US36380,36380,"United States - Okeechobee, FL Micro Area","Okeechobee, FL Micro Area",39996,39996,40030,39854,39700,39469,39563,39807,40697,41605
0100000US,,United States,310M300US36460,36460,"United States - Olean, NY Micro Area","Olean, NY Micro Area",80317,80343,80232,79829,79375,79033,78726,78006,77761,77348
0100000US,,United States,310M300US36580,36580,"United States - Oneonta, NY Micro Area","Oneonta, NY Micro Area",62259,62272,62256,61972,61761,61641,60994,60676,60343,60094
0100000US,,United States,310M300US36620,36620,"United States - Ontario, OR-ID Micro Area","Ontario, OR-ID Micro Area",53936,53934,53984,53377,53304,53193,53110,52988,53313,53695
0100000US,,United States,310M300US36660,36660,"United States - Opelousas, LA Micro Area","Opelousas, LA Micro Area",83384,83387,83492,83430,83464,83408,83665,83625,83703,83497
0100000US,,United States,310M300US36700,36700,"United States - Orangeburg, SC Micro Area","Orangeburg, SC Micro Area",92501,92495,92308,91678,91443,90652,90005,89115,88334,87476
0100000US,,United States,310M300US36820,36820,"United States - Oskaloosa, IA Micro Area","Oskaloosa, IA Micro Area",22381,22381,22406,22490,22393,22405,22352,22308,22206,22235
0100000US,,United States,310M300US36830,36830,"United States - Othello, WA Micro Area","Othello, WA Micro Area",18728,18728,18789,18891,18978,19142,19196,19201,19262,19506
0100000US,,United States,310M300US36840,36840,"United States - Ottawa, KS Micro Area","Ottawa, KS Micro Area",25992,25996,25984,25846,25817,25725,25531,25461,25547,25733
0100000US,,United States,310M300US36860,36860,"United States - Ottawa-Peru, IL Micro Area","Ottawa-Peru, IL Micro Area",154908,154899,154783,154096,153153,152382,151358,150272,149657,149037
0100000US,,United States,310M300US36900,36900,"United States - Ottumwa, IA Micro Area","Ottumwa, IA Micro Area",44378,44378,44441,44233,44132,44242,44138,44210,44171,44010
0100000US,,United States,310M300US36940,36940,"United States - Owatonna, MN Micro Area","Owatonna, MN Micro Area",36576,36576,36493,36566,36307,36362,36489,36621,36703,36887
0100000US,,United States,310M300US37020,37020,"United States - Owosso, MI Micro Area","Owosso, MI Micro Area",70648,70648,70611,69965,69299,68868,68770,68458,68541,68446
0100000US,,United States,310M300US37060,37060,"United States - Oxford, MS Micro Area","Oxford, MS Micro Area",47351,47359,47566,48348,50182,51385,51828,52654,53479,54374
0100000US,,United States,310M300US37080,37080,"United States - Oxford, NC Micro Area","Oxford, NC Micro Area",59916,57522,57660,57514,57587,57814,58067,58252,58824,59557
0100000US,,United States,310M300US37120,37120,"United States - Ozark, AL Micro Area","Ozark, AL Micro Area",50251,50247,50392,50107,50287,49759,49409,49344,49228,49226
0100000US,,United States,310M300US37140,37140,"United States - Paducah, KY-IL Micro Area","Paducah, KY-IL Micro Area",98762,98760,98702,98879,98417,97798,97624,97053,97083,97037
0100000US,,United States,310M300US37220,37220,"United States - Pahrump, NV Micro Area","Pahrump, NV Micro Area",43946,43945,43847,44002,43632,42924,42904,43052,43399,44202
0100000US,,United States,310M300US37260,37260,"United States - Palatka, FL Micro Area","Palatka, FL Micro Area",74364,74366,74204,73635,72913,72366,71983,71957,72404,73464
0100000US,,United States,310M300US37300,37300,"United States - Palestine, TX Micro Area","Palestine, TX Micro Area",58458,58458,58495,58379,58036,57960,57837,57641,57558,57741
0100000US,,United States,310M300US37420,37420,"United States - Pampa, TX Micro Area","Pampa, TX Micro Area",22535,22535,22467,22651,22908,22986,23437,23245,22738,22404
