0100000US,,United States,310M300US17200,17200,"United States - Claremont-Lebanon, NH-VT Micro Area","Claremont-Lebanon, NH-VT Micro Area",218466,218467,218410,218136,217478,217293,217144,216260,216458,216537
0100000US,,United States,310M300US17220,17220,"United States - Clarksburg, WV Micro Area","Clarksburg, WV Micro Area",94196,94196,94348,94482,94368,94449,94236,94133,93810,93301
0100000US,,United States,310M300US17260,17260,"United States - Clarksdale, MS Micro Area","Clarksdale, MS Micro Area",26151,26145,26106,25846,25613,25181,24842,24481,23820,23154
0100000US,,United States,310M300US17340,17340,"United States - Clearlake, CA Micro Area","Clearlake, CA Micro Area",64665,64665,64742,64273,64005,63855,64113,64310,63950,64246
0100000US,,United States,310M300US17380,17380,"United States - Cleveland, MS Micro Area","Cleveland, MS Micro Area",34145,34148,34099,33794,33988,33974,33803,33251,32634,31945
0100000US,,United States,310M300US17500,17500,"United States - Clewiston, FL Micro Area","Clewiston, FL Micro Area",39140,39140,39015,38941,37846,37767,38473,39094,39640,40347
0100000US,,United States,310M300US17540,17540,"United States - Clinton, IA Micro Area","Clinton, IA Micro Area",49116,49116,49092,49086,48700,48264,47882,47545,47236,47010
0100000US,,United States,310M300US17580,17580,"United States - Clovis, NM Micro Area","Clovis, NM Micro Area",48376,48376,48964,49710,50652,50494,50874,50068,50168,49812
0100000US,,United States,310M300US17700,17700,"United States - Coffeyville, KS Micro Area","Coffeyville, KS Micro Area",35471,35468,35353,34778,34476,34442,34067,33384,32867,32556
0100000US,,United States,310M300US17740,17740,"United States - Coldwater, MI Micro Area","Coldwater, MI Micro Area",45248,45248,45179,43913,43769,43554,43690,43604,43457,43410
0100000US,,United States,310M300US18060,18060,"United States - Columbus, MS Micro Area","Columbus, MS Micro Area",59779,59779,59795,59591,59595,59791,59779,59574,59460,59186
0100000US,,United States,310M300US18100,18100,"United States - Columbus, NE Micro Area","Columbus, NE Micro Area",32237,32237,32305,32522,32693,32630,32759,32864,32946,33175
0100000US,,United States,310M300US18180,18180,"United States - Concord, NH Micro Area","Concord, NH Micro Area",146445,146447,146379,146704,146762,147058,147542,147843,148133,149216
0100000US,,United States,310M300US18220,18220,"United States - Connersville, IN Micro Area","Connersville, IN Micro Area",24277,24302,24327,24150,23950,23829,23443,23391,23257,23209
0100000US,,United States,310M300US18260,18260,"United States - Cookeville, TN Micro Area","Cookeville, TN Micro Area",106042,106063,106286,106709,107171,107531,108381,108688,109703,111363
0100000US,,United States,310M300US18300,18300,"United States - Coos Bay, OR Micro Area","Coos Bay, OR Micro Area",63043,63043,63000,62730,62634,62348,62333,62662,63375,63888
0100000US,,United States,310M300US18380,18380,"United States - Cordele, GA Micro Area","Cordele, GA Micro Area",23439,23439,23438,23761,23598,23316,23076,22962,22935,22736
0100000US,,United States,310M300US18420,18420,"United States - Corinth, MS Micro Area","Corinth, MS Micro Area",37057,37057,37103,37269,37201,37274,37235,37250,37240,37210
0100000US,,United States,310M300US18460,18460,"United States - Cornelia, GA Micro Area","Cornelia, GA Micro Area",43041,43041,43068,43066,43419,43206,43620,43819,44177,44567
0100000US,,United States,310M300US18500,18500,"United States - Corning, NY Micro Area","Corning, NY Micro Area",98990,98986,99011,99156,98948,98881,98208,97495,96830,96281
0100000US,,United States,310M300US18620,18620,"United States - Corsicana, TX Micro Area","Corsicana, TX Micro Area",47735,47840,47869,48053,48138,48029,47918,48170,48375,48701
0100000US,,United States,310M300US18660,18660,"United States - Cortland, NY Micro Area","Cortland, NY Micro Area",49336,49285,49277,49373,49024,48912,48742,48294,47934,47786
0100000US,,United States,310M300US18740,18740,"United States - Coshocton, OH Micro Area","Coshocton, OH Micro Area",36901,36898,36936,36925,36820,36718,36526,36579,36644,36544
0100000US,,United States,310M300US18780,18780,"United States - Craig, CO Micro Area","Craig, CO Micro Area",13795,13795,13798,13412,13159,13115,12931,12940,13161,13131
0100000US,,United States,310M300US18820,18820,"United States - Crawfordsville, IN Micro Area","Crawfordsville, IN Micro Area",38124,38121,38097,38335,38175,38133,38161,38298,38323,38525
0100000US,,United States,310M300US18860,18860,"United States - Crescent City, CA Micro Area","Crescent City, CA Micro Area",28610,28610,28566,28447,28203,27830,27206,27253,27450,27470
0100000US,,United States,310M300US18900,18900,"United States - Crossville, TN Micro Area","Crossville, TN Micro Area",56053,56062,56197,56522,56894,57322,57836,58122,58532,59078
0100000US,,United States,310M300US18980,18980,"United States - Cullman, AL Micro Area","Cullman, AL Micro Area",80406,80410,80466,80411,80275,80674,81041,81721,82322,82755
0100000US,,United States,310M300US19000,19000,"United States - Cullowhee, NC Micro Area","Cullowhee, NC Micro Area",40271,40276,40370,40274,40679,41055,40989,41338,42268,42973
0100000US,,United States,310M300US19220,19220,"United States - Danville, KY Micro Area","Danville, KY Micro Area",53174,53170,53383,53497,53402,54037,54207,54074,54234,54380
0100000US,,United States,310M300US19260,19260,"United States - Danville, VA Micro Area","Danville, VA Micro Area",106561,106550,106511,105901,105608,105191,104613,103897,103316,102388
0100000US,,United States,310M300US19420,19420,"United States - Dayton, TN Micro Area","Dayton, TN Micro Area",31809,31802,31857,32065,32328,32463,32525,32320,32392,32691
0100000US,,United States,310M300US19540,19540,"United States - Decatur, IN Micro Area","Decatur, IN Micro Area",34387,34387,34451,34372,34403,34649,34763,34954,35232,35491
0100000US,,United States,310M300US19580,19580,"United States - Defiance, OH Micro Area","Defiance, OH Micro Area",39037,39031,39082,38988,38797,38521,38481,38276,38121,38156
0100000US,,United States,310M300US19620,19620,"United States - Del Rio, TX Micro Area","Del Rio, TX Micro Area",48879,48879,48977,48950,48923,49010,48808,48906,48953,49205
0100000US,,United States,310M300US19700,19700,"United States - Deming, NM Micro Area","Deming, NM Micro Area",25095,25096,25082,25089,24906,24562,24385,24281,24288,24078
0100000US,,United States,310M300US19760,19760,"United States - DeRidder, LA Micro Area","DeRidder, LA Micro Area",35654,35654,35834,36090,36343,36278,36261,36526,36998,36928
0100000US,,United States,310M300US19860,19860,"United States - Dickinson, ND Micro Area","Dickinson, ND Micro Area",24199,24199,24350,25161,26899,28329,30338,31850,30856,30209
0100000US,,United States,310M300US19940,19940,"United States - Dixon, IL Micro Area","Dixon, IL Micro Area",36031,36031,35976,35594,35202,35106,34897,34544,34399,34406
0100000US,,United States,310M300US19980,19980,"United States - Dodge City, KS Micro Area","Dodge City, KS Micro Area",33848,33848,34024,34433,34765,34937,34893,34578,34501,34381
0100000US,,United States,310M300US20060,20060,"United States - Douglas, GA Micro Area","Douglas, GA Micro Area",42356,42356,42738,43032,43178,43137,42977,43099,43015,43014
0100000US,,United States,310M300US20140,20140,"United States - Dublin, GA Micro Area","Dublin, GA Micro Area",58414,58418,58384,57853,57775,57591,57461,57165,56922,57118
0100000US,,United States,310M300US20180,20180,"United States - DuBois, PA Micro Area","DuBois, PA Micro Area",81642,81594,81515,81364,81349,81378,80947,80651,80035,79685
0100000US,,United States,310M300US20300,20300,"United States - Dumas, TX Micro Area","Dumas, TX Micro Area",21904,21904,22010,22090,22437,22145,22021,21880,21935,22097
0100000US,,United States,310M300US20340,20340,"United States - Duncan, OK Micro Area","Duncan, OK Micro Area",45048,45048,45101,45109,44886,44992,44576,44574,43993,43332
0100000US,,United States,310M300US20380,20380,"United States - Dunn, NC Micro Area","Dunn, NC Micro Area",114678,114697,115760,119214,122258,125104,126801,128205,130899,132754
0100000US,,United States,310M300US20420,20420,"United States - Durango, CO Micro Area","Durango, CO Micro Area",51334,51335,51338,51770,52338,53250,53740,54552,55216,55589
0100000US,,United States,310M300US20460,20460,"United States - Durant, OK Micro Area","Durant, OK Micro Area",42416,42416,42582,43127,43434,44101,44458,44971,45492,46319
0100000US,,United States,310M300US20540,20540,"United States - Dyersburg, TN Micro Area","Dyersburg, TN Micro Area",38335,38330,38318,38110,38183,38088,37815,37782,37605,37463
0100000US,,United States,310M300US20580,20580,"United States - Eagle Pass, TX Micro Area","Eagle Pass, TX Micro Area",54258,54258,54447,55224,55658,56462,57031,57658,57989,58216
0100000US,,United States,310M300US20660,20660,"United States - Easton, MD Micro Area","Easton, MD Micro Area",37782,37782,37879,37949,37991,37910,37582,37507,37204,37103
0100000US,,United States,310M300US20780,20780,"United States - Edwards, CO Micro Area","Edwards, CO Micro Area",52197,52197,52102,51892,52189,52685,53143,53664,54364,54772
0100000US,,United States,310M300US20820,20820,"United States - Effingham, IL Micro Area","Effingham, IL Micro Area",34242,34242,34219,34258,34263,34205,34107,34196,34182,34132
0100000US,,United States,310M300US20900,20900,"United States - El Campo, TX Micro Area","El Campo, TX Micro Area",41280,41280,41278,41260,41064,41095,41073,41379,41634,41968
0100000US,,United States,310M300US20980,20980,"United States - El Dorado, AR Micro Area","El Dorado, AR Micro Area",41639,41639,41571,41387,40850,40593,40129,40073,39867,39449
0100000US,,United States,310M300US21020,21020,"United States - Elizabeth City, NC Micro Area","Elizabeth City, NC Micro Area",64094,64094,64120,63799,63979,63298,63245,63138,63465,63798
0100000US,,United States,310M300US21120,21120,"United States - Elk City, OK Micro Area","Elk City, OK Micro Area",22119,22119,22058,22300,23062,23468,23600,23563,22432,21793
0100000US,,United States,310M300US21180,21180,"United States - Elkins, WV Micro Area","Elkins, WV Micro Area",29405,29405,29363,29424,29390,29532,29316,29165,28962,28785
0100000US,,United States,310M300US21220,21220,"United States - Elko, NV Micro Area","Elko, NV Micro Area",50805,50929,51081,51466,53045,54495,54646,53879,54223,54610
0100000US,,United States,310M300US21260,21260,"United States - Ellensburg, WA Micro Area","Ellensburg, WA Micro Area",40915,40906,40985,41539,41611,41825,42582,43091,44928,46205
0100000US,,United States,310M300US21380,21380,"United States - Emporia, KS Micro Area","Emporia, KS Micro Area",33690,33690,33650,33632,33534,33463,33134,33119,33400,33392
0100000US,,United States,310M300US21460,21460,"United States - Enterprise, AL Micro Area","Enterprise, AL Micro Area",49948,49948,50203,50434,51113,50647,50652,50974,51217,51874
0100000US,,United States,310M300US21540,21540,"United States - Escanaba, MI Micro Area","Escanaba, MI Micro Area",37069,37069,37049,36940,36833,36798,36575,36412,36225,35965
0100000US,,United States,310M300US21580,21580,"United States - Espaola, NM Micro Area","Espaola, NM Micro Area",40246,40234,40301,40235,40167,40003,39667,39287,39158,39159
0100000US,,United States,310M300US21640,21640,"United States - Eufaula, AL-GA Micro Area","Eufaula, AL-GA Micro Area",29970,29970,29847,29808,29585,29318,29039,28545,28107,27628
0100000US,,United States,310M300US21700,21700,"United States - Eureka-Arcata-Fortuna, CA Micro Area","Eureka-Arcata-Fortuna, CA Micro Area",134623,134623,135019,135239,134596,134444,134584,135219,136449,136754
0100000US,,United States,310M300US21740,21740,"United States - Evanston, WY Micro Area","Evanston, WY Micro Area",21118,21118,21093,20899,20999,20960,20845,20780,20711,20495
0100000US,,United States,310M300US21840,21840,"United States - Fairfield, IA Micro Area","Fairfield, IA Micro Area",16843,16840,16829,17014,17215,17509,17693,17927,18172,18422
0100000US,,United States,310M300US21860,21860,"United States - Fairmont, MN Micro Area","Fairmont, MN Micro Area",20840,20840,20801,20617,20456,20421,20238,20020,19890,19850
0100000US,,United States,310M300US21900,21900,"United States - Fairmont, WV Micro Area","Fairmont, WV Micro Area",56418,56418,56534,56649,56727,56651,56722,56690,56477,56337
0100000US,,United States,310M300US21980,21980,"United States - Fallon, NV Micro Area","Fallon, NV Micro Area",24877,24877,24822,24618,24278,23958,23883,24024,24016,24230
0100000US,,United States,310M300US22060,22060,"United States - Faribault-Northfield, MN Micro Area","Faribault-Northfield, MN Micro Area",64142,64142,64236,64457,64442,64635,64917,65149,65588,65968
0100000US,,United States,310M300US22100,22100,"United States - Farmington, MO Micro Area","Farmington, MO Micro Area",65359,65370,65531,65576,65798,66106,65794,66242,66393,66705
0100000US,,United States,310M300US22260,22260,"United States - Fergus Falls, MN Micro Area","Fergus Falls, MN Micro Area",57303,57303,57293,57279,57220,57504,57521,57599,57981,58345
0100000US,,United States,310M300US22280,22280,"United States - Fernley, NV Micro Area","Fernley, NV Micro Area",51980,51980,52043,51399,50998,51124,51384,52032,52854,54122
0100000US,,United States,310M300US22300,22300,"United States - Findlay, OH Micro Area","Findlay, OH Micro Area",74782,74789,74687,74903,75443,75516,75189,75493,75590,75754
0100000US,,United States,310M300US22340,22340,"United States - Fitzgerald, GA Micro Area","Fitzgerald, GA Micro Area",17634,17634,17620,17563,17577,17426,17423,17323,17190,16996
0100000US,,United States,310M300US22580,22580,"United States - Forest City, NC Micro Area","Forest City, NC Micro Area",67810,67816,67734,67414,67215,66830,66557,66373,66305,66551
0100000US,,United States,310M300US22620,22620,"United States - Forrest City, AR Micro Area","Forrest City, AR Micro Area",28258,28254,28195,27980,27973,27491,27078,26636,26304,25930
0100000US,,United States,310M300US22700,22700,"United States - Fort Dodge, IA Micro Area","Fort Dodge, IA Micro Area",38013,38013,37883,37728,37313,37312,37042,37015,36752,36605
0100000US,,United States,310M300US22780,22780,"United States - Fort Leonard Wood, MO Micro Area","Fort Leonard Wood, MO Micro Area",52274,52274,52846,53254,53453,54083,53616,53292,52611,52059
0100000US,,United States,310M300US22800,22800,"United States - Fort Madison-Keokuk, IA-IL-MO Micro Area","Fort Madison-Keokuk, IA-IL-MO Micro Area",62105,62095,62074,61575,61323,60669,60260,59913,59406,59038
0100000US,,United States,310M300US22820,22820,"United States - Fort Morgan, CO Micro Area","Fort Morgan, CO Micro Area",28159,28159,28234,28396,28198,28169,28044,28145,28063,28192
0100000US,,United States,310M300US22840,22840,"United States - Fort Payne, AL Micro Area","Fort Payne, AL Micro Area",71109,71115,71169,71353,70944,70905,71034,71198,71216,71617
0100000US,,United States,310M300US22860,22860,"United States - Fort Polk South, LA Micro Area","Fort Polk South, LA Micro Area",52334,52334,52721,52243,54123,52832,52852,51497,51621,50726
0100000US,,United States,310M300US23140,23140,"United States - Frankfort, IN Micro Area","Frankfort, IN Micro Area",33224,33223,33225,33052,32909,32788,32493,32411,32267,32317
0100000US,,United States,310M300US23180,23180,"United States - Frankfort, KY Micro Area","Frankfort, KY Micro Area",70706,70704,70690,70816,71077,71130,71512,71873,72385,73029
0100000US,,United States,310M300US23240,23240,"United States - Fredericksburg, TX Micro Area","Fredericksburg, TX Micro Area",24837,24837,24885,25038,25152,25320,25465,25959,26305,26646
0100000US,,United States,310M300US23300,23300,"United States - Freeport, IL Micro Area","Freeport, IL Micro Area",47711,47711,47606,47316,46884,46667,46264,45670,45540,45054
0100000US,,United States,310M300US23340,23340,"United States - Fremont, NE Micro Area","Fremont, NE Micro Area",36691,36685,36671,36929,36592,36508,36591,36505,36567,36707
0100000US,,United States,310M300US23380,23380,"United States - Fremont, OH Micro Area","Fremont, OH Micro Area",60944,60946,60883,60596,60454,60040,59823,59454,59281,59195
0100000US,,United States,310M300US23500,23500,"United States - Gaffney, SC Micro Area","Gaffney, SC Micro Area",55342,55467,55515,55684,55809,56049,56352,56516,56725,57105
0100000US,,United States,310M300US23620,23620,"United States - Gainesville, TX Micro Area","Gainesville, TX Micro Area",38437,38430,38463,38384,38675,38429,38691,39063,39244,39895
0100000US,,United States,310M300US23660,23660,"United States - Galesburg, IL Micro Area","Galesburg, IL Micro Area",52919,52919,52905,52676,52271,52084,51889,51313,50945,50638
0100000US,,United States,310M300US23700,23700,"United States - Gallup, NM Micro Area","Gallup, NM Micro Area",71492,71488,71671,72298,72327,72604,72733,73386,72958,72564
0100000US,,United States,310M300US23780,23780,"United States - Garden City, KS Micro Area","Garden City, KS Micro Area",40753,40762,40953,41080,41116,40996,41076,41125,40898,41044
0100000US,,United States,310M300US23820,23820,"United States - Gardnerville Ranchos, NV Micro Area","Gardnerville Ranchos, NV Micro Area",46997,46997,47035,46984,46936,46971,47434,47501,47947,48309
0100000US,,United States,310M300US23860,23860,"United States - Georgetown, SC Micro Area","Georgetown, SC Micro Area",60158,60158,60176,60027,60103,60343,60691,61310,61374,61607
0100000US,,United States,310M300US23940,23940,"United States - Gillette, WY Micro Area","Gillette, WY Micro Area",46133,46133,46233,46560,47861,48051,48192,49293,48800,46242
0100000US,,United States,310M300US23980,23980,"United States - Glasgow, KY Micro Area","Glasgow, KY Micro Area",52272,52272,52254,52376,52574,52868,53010,53457,53799,53908
0100000US,,United States,310M300US24060,24060,"United States - Glenwood Springs, CO Micro Area","Glenwood Springs, CO Micro Area",73537,73537,73254,73110,73953,74313,74784,75553,76800,77008
0100000US,,United States,310M300US24100,24100,"United States - Gloversville, NY Micro Area","Gloversville, NY Micro Area",55531,55523,55467,55122,54869,54376,53975,53853,53696,53877
0100000US,,United States,310M300US24330,24330,"United States - Grand Rapids, MN Micro Area","Grand Rapids, MN Micro Area",45058,45058,45034,45098,45145,45331,45322,45246,45149,45137
0100000US,,United States,310M300US24380,24380,"United States - Grants, NM Micro Area","Grants, NM Micro Area",27213,27215,27318,27470,27379,27341,27080,26976,26996,26853
0100000US,,United States,310M300US24460,24460,"United States - Great Bend, KS Micro Area","Great Bend, KS Micro Area",27674,27672,27674,27703,27537,27458,27329,27163,26911,26476
0100000US,,United States,310M300US24620,24620,"United States - Greeneville, TN Micro Area","Greeneville, TN Micro Area",68831,68825,68838,69090,68692,68293,68440,68500,68559,68808
0100000US,,United States,310M300US24640,24640,"United States - Greenfield Town, MA Micro Area","Greenfield Town, MA Micro Area",71372,71372,71353,71658,71631,71311,71195,70803,70618,70702
0100000US,,United States,310M300US24700,24700,"United States - Greensburg, IN Micro Area","Greensburg, IN Micro Area",25740,25731,25789,25880,26020,26216,26427,26380,26641,26737
0100000US,,United States,310M300US24740,24740,"United States - Greenville, MS Micro Area","Greenville, MS Micro Area",51137,51135,51095,50442,50012,49651,48997,47952,47191,46221
0100000US,,United States,310M300US24820,24820,"United States - Greenville, OH Micro Area","Greenville, OH Micro Area",52959,52969,52964,52646,52508,52294,52173,51956,51636,51536
0100000US,,United States,310M300US24900,24900,"United States - Greenwood, MS Micro Area","Greenwood, MS Micro Area",42914,42979,43018,42482,41189,41059,40918,40396,39938,39362
0100000US,,United States,310M300US24940,24940,"United States - Greenwood, SC Micro Area","Greenwood, SC Micro Area",95078,95077,95068,94924,94984,94730,94440,94709,94889,95077
0100000US,,United States,310M300US24980,24980,"United States - Grenada, MS Micro Area","Grenada, MS Micro Area",21906,21906,21842,21608,21620,21540,21600,21448,21219,21087
0100000US,,United States,310M300US25100,25100,"United States - Guymon, OK Micro Area","Guymon, OK Micro Area",20640,20640,20819,21188,21497,21959,21677,21379,21131,20900
0100000US,,United States,310M300US25200,25200,"United States - Hailey, ID Micro Area","Hailey, ID Micro Area",27701,27701,27621,27314,27435,27603,27755,27861,28092,28444
0100000US,,United States,310M300US25300,25300,"United States - Hannibal, MO Micro Area","Hannibal, MO Micro Area",38948,38948,38970,39045,38959,38922,39029,38849,38895,38858
0100000US,,United States,310M300US25460,25460,"United States - Harrison, AR Micro Area","Harrison, AR Micro Area",45233,45237,45198,45325,45370,45359,44968,44951,45060,45209
0100000US,,United States,310M300US25580,25580,"United States - Hastings, NE Micro Area","Hastings, NE Micro Area",31364,31367,31324,31206,31369,31547,31387,31549,31657,31678
0100000US,,United States,310M300US25700,25700,"United States - Hays, KS Micro Area","Hays, KS Micro Area",28452,28452,28424,28752,29074,29012,28934,28929,28823,28689
0100000US,,United States,310M300US25720,25720,"United States - Heber, UT Micro Area","Heber, UT Micro Area",23530,23525,23644,24433,25428,26673,27906,29273,30571,32106
0100000US,,United States,310M300US25740,25740,"United States - Helena, MT Micro Area","Helena, MT Micro Area",74801,74798,74971,75613,76039,76575,77083,77691,78562,79664
0100000US,,United States,310M300US25760,25760,"United States - Helena-West Helena, AR Micro Area","Helena-West Helena, AR Micro Area",21757,21755,21675,21405,20740,20443,19962,19562,19050,18572
0100000US,,United States,310M300US25780,25780,"United States - Henderson, NC Micro Area","Henderson, NC Micro Area",45422,45419,45301,45300,45105,44502,44528,44433,44426,44211
0100000US,,United States,310M300US25820,25820,"United States - Hereford, TX Micro Area","Hereford, TX Micro Area",19372,19372,19458,19490,19327,19148,19099,18802,18850,18836
0100000US,,United States,310M300US25840,25840,"United States - Hermiston-Pendleton, OR Micro Area","Hermiston-Pendleton, OR Micro Area",87062,87062,87298,87950,88184,88079,87745,87598,87868,88151
0100000US,,United States,310M300US25880,25880,"United States - Hillsdale, MI Micro Area","Hillsdale, MI Micro Area",46688,46688,46643,46590,46255,46122,45916,45860,45767,45879
0100000US,,United States,310M300US25900,25900,"United States - Hilo, HI Micro Area","Hilo, HI Micro Area",185079,185076,185347,187049,189118,191583,194240,196740,198681,200381
0100000US,,United States,310M300US26020,26020,"United States - Hobbs, NM Micro Area","Hobbs, NM Micro Area",64727,64727,64594,64990,66156,68173,69757,70985,69850,68759
0100000US,,United States,310M300US26090,26090,"United States - Holland, MI Micro Area","Holland, MI Micro Area",111408,111410,111522,111137,111448,111946,113290,114085,114955,116447
0100000US,,United States,310M300US26220,26220,"United States - Hood River, OR Micro Area","Hood River, OR Micro Area",22346,22346,22443,22438,22583,22607,22685,22955,23064,23377
0100000US,,United States,310M300US26260,26260,"United States - Hope, AR Micro Area","Hope, AR Micro Area",31606,31613,31594,31495,31256,31204,30999,30618,30400,30188
0100000US,,United States,310M300US26340,26340,"United States - Houghton, MI Micro Area","Houghton, MI Micro Area",38784,38784,38893,38907,38821,38698,38520,38291,38426,38410
0100000US,,United States,310M300US26460,26460,"United States - Hudson, NY Micro Area","Hudson, NY Micro Area",63096,63066,63039,62538,62473,62225,62018,61549,61010,60604
0100000US,,United States,310M300US26500,26500,"United States - Huntingdon, PA Micro Area","Huntingdon, PA Micro Area",45913,46031,46029,46041,45990,45928,45869,45640,45503,45491
0100000US,,United States,310M300US26540,26540,"United States - Huntington, IN Micro Area","Huntington, IN Micro Area",37124,37124,37118,37161,36975,36774,36603,36518,36368,36337
0100000US,,United States,310M300US26660,26660,"United States - Huntsville, TX Micro Area","Huntsville, TX Micro Area",82446,82536,82970,83095,82966,83867,84277,85225,86214,86912
0100000US,,United States,310M300US26700,26700,"United States - Huron, SD Micro Area","Huron, SD Micro Area",17398,17399,17413,17693,17940,18269,18144,18160,18087,18157
0100000US,,United States,310M300US26740,26740,"United States - Hutchinson, KS Micro Area","Hutchinson, KS Micro Area",64511,64511,64549,64425,64212,64083,63678,63488,63040,62510
0100000US,,United States,310M300US26780,26780,"United States - Hutchinson, MN Micro Area","Hutchinson, MN Micro Area",36651,36651,36597,36354,35942,35898,35759,35791,35748,35884
0100000US,,United States,310M300US26860,26860,"United States - Indiana, PA Micro Area","Indiana, PA Micro Area",88880,88893,88869,88608,88246,88195,87486,86867,85256,84953
0100000US,,United States,310M300US26940,26940,"United States - Indianola, MS Micro Area","Indianola, MS Micro Area",29450,29385,28983,28515,28404,27906,27398,26902,26389,25981
0100000US,,United States,310M300US26960,26960,"United States - Ionia, MI Micro Area","Ionia, MI Micro Area",63905,63905,63846,63853,63873,63982,64229,64051,64182,64291
0100000US,,United States,310M300US27020,27020,"United States - Iron Mountain, MI-WI Micro Area","Iron Mountain, MI-WI Micro Area",30591,30591,30553,30442,30532,30389,30235,29993,29849,29786
0100000US,,United States,310M300US27160,27160,"United States - Jackson, OH Micro Area","Jackson, OH Micro Area",33225,33226,33255,33128,32876,32802,32771,32564,32534,32449
0100000US,,United States,310M300US27220,27220,"United States - Jackson, WY-ID Micro Area","Jackson, WY-ID Micro Area",31464,31459,31446,31640,31797,32676,33209,33700,34266,34646
0100000US,,United States,310M300US27300,27300,"United States - Jacksonville, IL Micro Area","Jacksonville, IL Micro Area",40902,40906,40838,40713,40607,40205,39851,39651,39249,38800
